{
  "mode": "recursive",
  "strategy": "divide_and_conquer",
  "currentDepth": 0,
  "maxDepth": 20,
  "baseCaseReached": false,
  "baseCases": [
    {
      "id": "bc1",
      "condition": "config has no nested sub-configs (leaf node)",
      "result": "validate primitive fields directly; return list of field-level errors"
    },
    {
      "id": "bc2",
      "condition": "config is null or empty",
      "result": "return empty error list"
    }
  ],
  "recurrence": {
    "formula": "validate(config) = validateFields(config) ++ flatMap(validate, config.subConfigs)",
    "closedForm": "O(n) where n = total number of config nodes",
    "timeComplexity": "O(n)",
    "spaceComplexity": "O(d) where d = maximum nesting depth"
  },
  "subproblems": [
    {
      "id": "sp1",
      "description": "validate each sub-config block using the same validation rules",
      "size": "number of nodes in the sub-config subtree",
      "status": "pending"
    }
  ],
  "memoization": {
    "enabled": false,
    "hits": 0,
    "misses": 0,
    "cacheSize": 0
  }
}
